SO Name,JC IEEE/IET Electronic Library 2012_2012,,,,,,,,,,,,,,,,,,,
SO Identifier,IEEE_IEEEIEL_2012_2012_jc,,,,,,,,,,,,,,,,,,,
Provider,IEEE,,,,,,,,,,,,,,,,,,,
Package Identifier,IEEE/IET Electronic Library ,,,,,,,,,,,,,,,,,,,
Package Name,IEEE/IET Electronic Library ,,,,,,,,,,,,,,,,,,,
Agreement Term Start Year,2012,,,,,,,,,,,,,,,,,,,
Agreement Term End Year,2012,,,,,,,,,,,,,,,,,,,
Consortium,JISC Collections,,,,,,,,,,,,,,,,,,,
Number of Proprietary_ID columns,0,,,,,,,,,,,,,,,,,,,
Number of Platforms listed,2,,,,,,,,,,,,,,,,,,,
publication_title,print_identifier,online_identifier,date_first_issue_online,num_first_vol_online,num_first_issue_online,date_last_issue_online,num_last_vol_online,num_last_issue_online,title_id,embargo_info,coverage_depth,coverage_notes,publisher_name,DOI,platform_name,platform_role,platform_title_url,platform_name,platform_role,platform_title_url
"Acoustics, Speech and Signal Processing, IEEE Transactions on",0096-3518,,1974,22,1,1990,38,12,29,,,,,,IEEE Xplore,host,http://ieeexplore.ieee.org/servlet/opac?punumber=29,IEEE Xplore,administrative,
"Acoustics, Speech, and Signal Processing Newsletter, IEEE",,,1974,28,1,1983,62,1,8342,,,,,,IEEE Xplore,host,http://ieeexplore.ieee.org/servlet/opac?punumber=8342,IEEE Xplore,administrative,
"Advanced Packaging, IEEE Transactions on",1521-3323,,1999,22,1,2010,,99,6040,,,,,,IEEE Xplore,host,http://ieeexplore.ieee.org/servlet/opac?punumber=6040,IEEE Xplore,administrative,
"Aeronautical and Navigational Electronics, IRE Transactions on",0096-1639,,1955,2,1,1960,7,4,4201388,,,,,,IEEE Xplore,host,http://ieeexplore.ieee.org/servlet/opac?punumber=4201388,IEEE Xplore,administrative,
"Aeronautical and Navigational Electronics, Transactions of the IRE Professional Group on",,,1953,10,1,1954,1,4,5062323,,,,,,IEEE Xplore,host,http://ieeexplore.ieee.org/servlet/opac?punumber=5062323,IEEE Xplore,administrative,
"Aerospace and Electronic Systems Magazine, IEEE",0885-8985,,1986,1,1,,,,62,,,,,,IEEE Xplore,host,http://ieeexplore.ieee.org/servlet/opac?punumber=62,IEEE Xplore,administrative,
"Aerospace and Electronic Systems, IEEE Transactions on",0018-9251,,1965,1,1,,,,7,,,,,,IEEE Xplore,host,http://ieeexplore.ieee.org/servlet/opac?punumber=7,IEEE Xplore,administrative,
"Aerospace and Navigational Electronics, IEEE Transactions on",0096-1957,,1963,10,1,1965,12,2,4319312,,,,,,IEEE Xplore,host,http://ieeexplore.ieee.org/servlet/opac?punumber=4319312,IEEE Xplore,administrative,
"Aerospace and Navigational Electronics, IRE Transactions on",0096-1647,,1961,8,1,1962,9,4,5483689,,,,,,IEEE Xplore,host,http://ieeexplore.ieee.org/servlet/opac?punumber=5483689,IEEE Xplore,administrative,
"Aerospace, IEEE Transactions on",0536-1516,,1963,1,1,1965,3,3,4319334,,,,,,IEEE Xplore,host,http://ieeexplore.ieee.org/servlet/opac?punumber=4319334,IEEE Xplore,administrative,
"Affective Computing, IEEE Transactions on",1949-3045,,2010,1,1,,,,5165369,,,,,,IEEE Xplore,host,http://ieeexplore.ieee.org/servlet/opac?punumber=5165369,IEEE Xplore,administrative,
"Airborne Electronics, Transactions of the IRE Professional Group on",,,1952,6,,1952,6,,5062335,,,,,,IEEE Xplore,host,http://ieeexplore.ieee.org/servlet/opac?punumber=5062335,IEEE Xplore,administrative,
"American Institute of Electrical Engineers, Transactions of the",0096-3860,,1884,,1,1951,70,2,4763772,,,,,,IEEE Xplore,host,http://ieeexplore.ieee.org/servlet/opac?punumber=4763772,IEEE Xplore,administrative,
Annals of the History of Computing,0164-1239,,1979,1,1,1991,13,4,5488650,,,,,,IEEE Xplore,host,http://ieeexplore.ieee.org/servlet/opac?punumber=5488650,IEEE Xplore,administrative,
"Annals of the History of Computing, IEEE",1058-6180,,1992,14,1,,,,85,,,,,,IEEE Xplore,host,http://ieeexplore.ieee.org/servlet/opac?punumber=85,IEEE Xplore,administrative,
"Antennas and Propagation Group Newsletter, IEEE",,,1964,7,1,1973,15,3,4545874,,,,,,IEEE Xplore,host,http://ieeexplore.ieee.org/servlet/opac?punumber=4545874,IEEE Xplore,administrative,
"Antennas and Propagation Magazine, IEEE",1045-9243,,1990,32,1,,,,74,,,,,,IEEE Xplore,host,http://ieeexplore.ieee.org/servlet/opac?punumber=74,IEEE Xplore,administrative,
"Antennas and Propagation Newsletter, IEEE Professional Technical Group on",,,1963,6,2,1963,6,2,4545875,,,,,,IEEE Xplore,host,http://ieeexplore.ieee.org/servlet/opac?punumber=4545875,IEEE Xplore,administrative,
"Antennas and Propagation Newsletter, IRE Professional Groups on",,,1958,1,1,1963,6,1,8235,,,,,,IEEE Xplore,host,http://ieeexplore.ieee.org/servlet/opac?punumber=8235,IEEE Xplore,administrative,
"Antennas and Propagation Society Newsletter, IEEE",,,1973,15,4,1987,31,6,8233,,,,,,IEEE Xplore,host,http://ieeexplore.ieee.org/servlet/opac?punumber=8233,IEEE Xplore,administrative,
"Antennas and Propagation, IEEE Transactions on",0018-926X,,1963,11,1,,,,8,,,,,,IEEE Xplore,host,http://ieeexplore.ieee.org/servlet/opac?punumber=8,IEEE Xplore,administrative,
"Antennas and Propagation, IRE Transactions on",0096-1973,,1955,3,2,1962,10,6,8234,,,,,,IEEE Xplore,host,http://ieeexplore.ieee.org/servlet/opac?punumber=8234,IEEE Xplore,administrative,
"Antennas and Propagation, Transactions of the IRE Professional Group on",,,1952,3,1,1954,3,1,8236,,,,,,IEEE Xplore,host,http://ieeexplore.ieee.org/servlet/opac?punumber=8236,IEEE Xplore,administrative,
"Antennas and Wireless Propagation Letters, IEEE",1536-1225,,2002,1,1,,,,7727,,,,,,IEEE Xplore,host,http://ieeexplore.ieee.org/servlet/opac?punumber=7727,IEEE Xplore,administrative,
"Applications and Industry, IEEE Transactions on",0536-1524,,1963,82,65,1964,83,75,5407695,,,,,,IEEE Xplore,host,http://ieeexplore.ieee.org/servlet/opac?punumber=5407695,IEEE Xplore,administrative,
"Applied Superconductivity, IEEE Transactions on",1051-8223,,1991,1,1,,,,77,,,,,,IEEE Xplore,host,http://ieeexplore.ieee.org/servlet/opac?punumber=77,IEEE Xplore,administrative,
"ASSP Magazine, IEEE",0740-7467,,1984,1,1,1990,7,4,53,,,,,,IEEE Xplore,host,http://ieeexplore.ieee.org/servlet/opac?punumber=53,IEEE Xplore,administrative,
"Audio and Electroacoustics Newsletter, IEEE",  ,,1970,16,1,1973,25,1,8338,,,,,,IEEE Xplore,host,http://ieeexplore.ieee.org/servlet/opac?punumber=8338,IEEE Xplore,administrative,
"Audio and Electroacoustics, IEEE Transactions on",0018-9278  ,,1966,14,1,1973,21,6,8337,,,,,,IEEE Xplore,host,http://ieeexplore.ieee.org/servlet/opac?punumber=8337,IEEE Xplore,administrative,
"Audio, IEEE Transactions on",0096-1620  ,,1963,11,1,1965,13,6,8336,,,,,,IEEE Xplore,host,http://ieeexplore.ieee.org/servlet/opac?punumber=8336,IEEE Xplore,administrative,
"Audio, IRE Transactions on",0096-1981  ,,1955,3,1,1962,10,6,8335,,,,,,IEEE Xplore,host,http://ieeexplore.ieee.org/servlet/opac?punumber=8335,IEEE Xplore,administrative,
"Audio, Newsletter of the IRE Professional Group on",,,1950,1,1,1952,3,1,8462,,,,,,IEEE Xplore,host,http://ieeexplore.ieee.org/servlet/opac?punumber=8462,IEEE Xplore,administrative,
"Audio, Speech, and Language Processing, IEEE Transactions on",1558-7916,,2006,14,1,,,,10376,,,,,,IEEE Xplore,host,http://ieeexplore.ieee.org/servlet/opac?punumber=10376,IEEE Xplore,administrative,
"Audio, Transactions of the IRE Professional Group on",  ,,1953,1,1,1955,2,6,8340,,,,,,IEEE Xplore,host,http://ieeexplore.ieee.org/servlet/opac?punumber=8340,IEEE Xplore,administrative,
"Automatic Control, IEEE Transactions on",0018-9286,,1963,8,1,,,,9,,,,,,IEEE Xplore,host,http://ieeexplore.ieee.org/servlet/opac?punumber=9,IEEE Xplore,administrative,
"Automatic Control, IRE Transactions on",0096-199X  ,,1956,1,1,1962,7,5,8163,,,,,,IEEE Xplore,host,http://ieeexplore.ieee.org/servlet/opac?punumber=8163,IEEE Xplore,administrative,
"Automation Science and Engineering, IEEE Transactions on",1545-5955,,2004,1,1,,,,8856,,,,,,IEEE Xplore,host,http://ieeexplore.ieee.org/servlet/opac?punumber=8856,IEEE Xplore,administrative,
"Autonomous Mental Development, IEEE Transactions on",1943-0604,,2009,1,1,,,,4563672,,,,,,IEEE Xplore,host,http://ieeexplore.ieee.org/servlet/opac?punumber=4563672,IEEE Xplore,administrative,
"Bio-medical Electronics, IEEE Transactions on",0096-0616,,1963,10,1,1963,10,4,5483695,,,,,,IEEE Xplore,host,http://ieeexplore.ieee.org/servlet/opac?punumber=5483695,IEEE Xplore,administrative,
"Bio-Medical Electronics, IRE Transactions on",0096-1884,,1961,8,1,1962,9,4,4322768,,,,,,IEEE Xplore,host,http://ieeexplore.ieee.org/servlet/opac?punumber=4322768,IEEE Xplore,administrative,
"Biomedical Circuits and Systems, IEEE Transactions on",1932-4545,,2007,1,1,,,,4156126,,,,,,IEEE Xplore,host,http://ieeexplore.ieee.org/servlet/opac?punumber=4156126,IEEE Xplore,administrative,
"Biomedical Engineering, IEEE Reviews in",1937-3333,,2008,1,99,,,,4664312,,,,,,IEEE Xplore,host,http://ieeexplore.ieee.org/servlet/opac?punumber=4664312,IEEE Xplore,administrative,
"Biomedical Engineering, IEEE Transactions on",0018-9294,,1964,11,1,,,,10,,,,,,IEEE Xplore,host,http://ieeexplore.ieee.org/servlet/opac?punumber=10,IEEE Xplore,administrative,
"Broadcast and Television Receivers, IEEE Transactions on",0018-9308,,1965,11,1,1974,20,4,4079767,,,,,,IEEE Xplore,host,http://ieeexplore.ieee.org/servlet/opac?punumber=4079767,IEEE Xplore,administrative,
"Broadcast and Television Receivers, IRE Transactions on",0096-1655,,1955,1,1,1962,8,3,4502897,,,,,,IEEE Xplore,host,http://ieeexplore.ieee.org/servlet/opac?punumber=4502897,IEEE Xplore,administrative,
"Broadcast and Television Receivers, Transactions of the IRE Professional Group on",,,1953,1,1,1954,6,1,4505045,,,,,,IEEE Xplore,host,http://ieeexplore.ieee.org/servlet/opac?punumber=4505045,IEEE Xplore,administrative,
"Broadcast Transmission Systems, IRE Transactions on",0099-6866,,1955,1,1,1958,12,1,4505116,,,,,,IEEE Xplore,host,http://ieeexplore.ieee.org/servlet/opac?punumber=4505116,IEEE Xplore,administrative,
"Broadcasting, IEEE Transactions on",0018-9316,,1963,9,1,,,,11,,,,,,IEEE Xplore,host,http://ieeexplore.ieee.org/servlet/opac?punumber=11,IEEE Xplore,administrative,
"Broadcasting, IRE Transactions on",0096-1663,,1959,13,1,1962,8,1,4501502,,,,,,IEEE Xplore,host,http://ieeexplore.ieee.org/servlet/opac?punumber=4501502,IEEE Xplore,administrative,
"Cable Television, IEEE Transactions on",0147-3204,,1976,1,1,1980,5,4,4065009,,,,,,IEEE Xplore,host,http://ieeexplore.ieee.org/servlet/opac?punumber=4065009,IEEE Xplore,administrative,
"Circuit Theory, IEEE Transactions on",0018-9324,,1963,10,1,1973,20,6,8147,,,,,,IEEE Xplore,host,http://ieeexplore.ieee.org/servlet/opac?punumber=8147,IEEE Xplore,administrative,
"Circuit Theory, IRE Transactions on",0096-2007,,1955,2,2,1962,9,4,8148,,,,,,IEEE Xplore,host,http://ieeexplore.ieee.org/servlet/opac?punumber=8148,IEEE Xplore,administrative,
"Circuit Theory, Transactions of the IRE Professional Group on",0197-6389,,1952,1,1,1954,1,4,4811122,,,,,,IEEE Xplore,host,http://ieeexplore.ieee.org/servlet/opac?punumber=4811122,IEEE Xplore,administrative,
"Circuits and Devices Magazine, IEEE",8755-3996,,1988,4,1,2006,22,6,101,,,,,,IEEE Xplore,host,http://ieeexplore.ieee.org/servlet/opac?punumber=101,IEEE Xplore,administrative,
"Circuits and Systems for Video Technology, IEEE Transactions on",1051-8215,,1991,1,1,,,,76,,,,,,IEEE Xplore,host,http://ieeexplore.ieee.org/servlet/opac?punumber=76,IEEE Xplore,administrative,
"Circuits and Systems I: Fundamental Theory and Applications, IEEE Transactions on",1057-7122,,1992,39,1,2003,50,12,81,,,,,,IEEE Xplore,host,http://ieeexplore.ieee.org/servlet/opac?punumber=81,IEEE Xplore,administrative,
"Circuits and Systems I: Regular Papers, IEEE Transactions on",1549-8328,,2004,51,1,,,,8919,,,,,,IEEE Xplore,host,http://ieeexplore.ieee.org/servlet/opac?punumber=8919,IEEE Xplore,administrative,
"Circuits and Systems II: Analog and Digital Signal Processing, IEEE Transactions on",1057-7130,,1992,39,1,2003,50,12,82,,,,,,IEEE Xplore,host,http://ieeexplore.ieee.org/servlet/opac?punumber=82,IEEE Xplore,administrative,
"Circuits and Systems II: Express Briefs, IEEE Transactions on",1549-7747,,2004,51,1,,,,8920,,,,,,IEEE Xplore,host,http://ieeexplore.ieee.org/servlet/opac?punumber=8920,IEEE Xplore,administrative,
"Circuits and Systems Magazine, IEEE",1531-636X,,2001,1,1,,,,7384,,,,,,IEEE Xplore,host,http://ieeexplore.ieee.org/servlet/opac?punumber=7384,IEEE Xplore,administrative,
"Circuits and Systems, IEEE Transactions on",0098-4094,,1974,21,1,1991,38,12,31,,,,,,IEEE Xplore,host,http://ieeexplore.ieee.org/servlet/opac?punumber=31,IEEE Xplore,administrative,
"Circuits, Devices & Systems, IET",1751-858X,,2007,1,1,,,,4123966,,,,,,IEEE Xplore,host,http://ieeexplore.ieee.org/servlet/opac?punumber=4123966,IEEE Xplore,administrative,
"Circuits, Devices and Systems, IEE Proceedings -",1350-2409,,1994,141,1,2006,153,6,2190,,,,,,IEEE Xplore,host,http://ieeexplore.ieee.org/servlet/opac?punumber=2190,IEEE Xplore,administrative,
"Circuits, Devices and Systems, IEE Proceedings G",0956-3768,,1989,136,1,1993,140,6,2211,,,,,,IEEE Xplore,host,http://ieeexplore.ieee.org/servlet/opac?punumber=2211,IEEE Xplore,administrative,
"Communication Technology, IEEE Transactions on",0018-9332,,1964,12,3,1971,19,6,4547467,,,,,,IEEE Xplore,host,http://ieeexplore.ieee.org/servlet/opac?punumber=4547467,IEEE Xplore,administrative,
"Communications and Networks, Journal of",,,2011,13,5,2011,13,5,5449605,,,,,,IEEE Xplore,host,http://ieeexplore.ieee.org/servlet/opac?punumber=5449605,IEEE Xplore,administrative,
Communications Engineer,1479-8352,,2003,1,1,2007,5,6,8515,,,,,,IEEE Xplore,host,http://ieeexplore.ieee.org/servlet/opac?punumber=8515,IEEE Xplore,administrative,
"Communications Letters, IEEE",1089-7798,,1997,1,1,,,,4234,,,,,,IEEE Xplore,host,http://ieeexplore.ieee.org/servlet/opac?punumber=4234,IEEE Xplore,administrative,
"Communications Magazine, IEEE",0163-6804,,1979,17,1,,,,35,,,,,,IEEE Xplore,host,http://ieeexplore.ieee.org/servlet/opac?punumber=35,IEEE Xplore,administrative,
Communications Society,0094-5579,,1973,10,1,1976,14,6,8158,,,,,,IEEE Xplore,host,http://ieeexplore.ieee.org/servlet/opac?punumber=8158,IEEE Xplore,administrative,
"Communications Society Magazine, IEEE",0148-9615,,1977,15,1,1978,16,6,5488653,,,,,,IEEE Xplore,host,http://ieeexplore.ieee.org/servlet/opac?punumber=5488653,IEEE Xplore,administrative,
"Communications Surveys & Tutorials, IEEE",1553-877X,,2005,1,1,,,,9739,,,,,,IEEE Xplore,host,http://ieeexplore.ieee.org/servlet/opac?punumber=9739,IEEE Xplore,administrative,
"Communications Systems, IEEE Transactions on",0096-1965,,1963,11,1,1964,12,2,4547466,,,,,,IEEE Xplore,host,http://ieeexplore.ieee.org/servlet/opac?punumber=4547466,IEEE Xplore,administrative,
"Communications Systems, IRE Transactions on",0096-2244,,1956,4,1,1962,10,4,4547465,,,,,,IEEE Xplore,host,http://ieeexplore.ieee.org/servlet/opac?punumber=4547465,IEEE Xplore,administrative,
"Communications Systems, Transactions of the IRE Professional Group on",0277-6243  ,,1953,1,1,1955,3,1,8161,,,,,,IEEE Xplore,host,http://ieeexplore.ieee.org/servlet/opac?punumber=8161,IEEE Xplore,administrative,
"Communications, IEE Proceedings-",1350-2425,,1994,141,1,2006,153,6,2191,,,,,,IEEE Xplore,host,http://ieeexplore.ieee.org/servlet/opac?punumber=2191,IEEE Xplore,administrative,
"Communications, IEEE Transactions on",0090-6778,,1972,20,1,,,,26,,,,,,IEEE Xplore,host,http://ieeexplore.ieee.org/servlet/opac?punumber=26,IEEE Xplore,administrative,
"Communications, IET",1751-8628,,2007,1,1,,,,4105970,,,,,,IEEE Xplore,host,http://ieeexplore.ieee.org/servlet/opac?punumber=4105970,IEEE Xplore,administrative,
"Communications, Radar and Signal Processing, IEE Proceedings F",0143-7070,,1980,127,1,1988,135,6,4644477,,,,,,IEEE Xplore,host,http://ieeexplore.ieee.org/servlet/opac?punumber=4644477,IEEE Xplore,administrative,
"Communications, Speech and Vision, IEE Proceedings I",0956-3776,,1988,136,1,1993,140,6,2215,,,,,,IEEE Xplore,host,http://ieeexplore.ieee.org/servlet/opac?punumber=2215,IEEE Xplore,administrative,
"Component Parts, IEEE Transactions on",0097-6601  ,,1963,10,1,1965,12,1,8216,,,,,,IEEE Xplore,host,http://ieeexplore.ieee.org/servlet/opac?punumber=8216,IEEE Xplore,administrative,
"Component Parts, IRE Transactions on",0096-2422  ,,1955,3,1,1962,9,4,8222,,,,,,IEEE Xplore,host,http://ieeexplore.ieee.org/servlet/opac?punumber=8222,IEEE Xplore,administrative,
"Component Parts, Transactions of the IRE Professional Group on",,,1954,1,1,1955,1,1,8219,,,,,,IEEE Xplore,host,http://ieeexplore.ieee.org/servlet/opac?punumber=8219,IEEE Xplore,administrative,
"Components and Packaging Technologies, IEEE Transactions on",1521-3331,,1999,22,1,2010,,99,6144,,,,,,IEEE Xplore,host,http://ieeexplore.ieee.org/servlet/opac?punumber=6144,IEEE Xplore,administrative,
"Components, Hybrids, and Manufacturing Technology, IEEE Transactions on",0148-6411,,1978,1,1,1993,16,8,33,,,,,,IEEE Xplore,host,http://ieeexplore.ieee.org/servlet/opac?punumber=33,IEEE Xplore,administrative,
"Components, Packaging and Manufacturing Technology, IEEE Transactions on",2156-3950,,2011,1,1,2011,,99,5503870,,,,,,IEEE Xplore,host,http://ieeexplore.ieee.org/servlet/opac?punumber=5503870,IEEE Xplore,administrative,
"Components, Packaging, and Manufacturing Technology, Part A, IEEE Transactions on",1070-9886,,1994,17,1,1998,21,4,95,,,,,,IEEE Xplore,host,http://ieeexplore.ieee.org/servlet/opac?punumber=95,IEEE Xplore,administrative,
"Components, Packaging, and Manufacturing Technology, Part B: Advanced Packaging, IEEE Transactions on",1070-9894,,1994,17,1,1998,21,4,96,,,,,,IEEE Xplore,host,http://ieeexplore.ieee.org/servlet/opac?punumber=96,IEEE Xplore,administrative,
"Components, Packaging, and Manufacturing Technology, Part C, IEEE Transactions on",1083-4400,,1996,19,1,1998,21,4,3476,,,,,,IEEE Xplore,host,http://ieeexplore.ieee.org/servlet/opac?punumber=3476,IEEE Xplore,administrative,
"Computational Biology and Bioinformatics, IEEE/ACM Transactions on",1545-5963,,2004,1,1,,,,8857,,,,,,IEEE Xplore,host,http://ieeexplore.ieee.org/servlet/opac?punumber=8857,IEEE Xplore,administrative,
"Computational Intelligence and AI in Games, IEEE Transactions on",1943-068X,,2009,1,1,,,,4804728,,,,,,IEEE Xplore,host,http://ieeexplore.ieee.org/servlet/opac?punumber=4804728,IEEE Xplore,administrative,
"Computational Intelligence Magazine, IEEE",1556-603X,,2006,1,1,,,,10207,,,,,,IEEE Xplore,host,http://ieeexplore.ieee.org/servlet/opac?punumber=10207,IEEE Xplore,administrative,
"Computational Science & Engineering, IEEE",1070-9924,,1994,1,1,1998,5,4,99,,,,,,IEEE Xplore,host,http://ieeexplore.ieee.org/servlet/opac?punumber=99,IEEE Xplore,administrative,
Computer,0018-9162,,1970,3,5,,,,2,,,,,,IEEE Xplore,host,http://ieeexplore.ieee.org/servlet/opac?punumber=2,IEEE Xplore,administrative,
"Computer Applications in Power, IEEE",0895-0156,,1988,1,1,2002,15,4,67,,,,,,IEEE Xplore,host,http://ieeexplore.ieee.org/servlet/opac?punumber=67,IEEE Xplore,administrative,
Computer Architecture Letters,1556-6056,,2002,1,1,,,,10208,,,,,,IEEE Xplore,host,http://ieeexplore.ieee.org/servlet/opac?punumber=10208,IEEE Xplore,administrative,
"Computer Graphics and Applications, IEEE",0272-1716,,1981,1,1,,,,38,,,,,,IEEE Xplore,host,http://ieeexplore.ieee.org/servlet/opac?punumber=38,IEEE Xplore,administrative,
"Computer Vision, IET",1751-9632,,2007,1,1,,,,4159597,,,,,,IEEE Xplore,host,http://ieeexplore.ieee.org/servlet/opac?punumber=4159597,IEEE Xplore,administrative,
"Computer-Aided Design of Integrated Circuits and Systems, IEEE Transactions on",0278-0070,,1982,1,1,,,,43,,,,,,IEEE Xplore,host,http://ieeexplore.ieee.org/servlet/opac?punumber=43,IEEE Xplore,administrative,
Computer-Aided Engineering Journal,0263-9327,,1988,1,1,1991,8,6,2217,,,,,,IEEE Xplore,host,http://ieeexplore.ieee.org/servlet/opac?punumber=2217,IEEE Xplore,administrative,
"Computers & Digital Techniques, IET",1751-8601,,2007,1,1,,,,4117424,,,,,,IEEE Xplore,host,http://ieeexplore.ieee.org/servlet/opac?punumber=4117424,IEEE Xplore,administrative,
"Computers and Digital Techniques, IEE Journal on",0140-1335,,1978,1,1,1979,2,6,4807224,,,,,,IEEE Xplore,host,http://ieeexplore.ieee.org/servlet/opac?punumber=4807224,IEEE Xplore,administrative,
"Computers and Digital Techniques, IEE Proceedings -",1350-2387,,1994,141,1,2006,153,6,2192,,,,,,IEEE Xplore,host,http://ieeexplore.ieee.org/servlet/opac?punumber=2192,IEEE Xplore,administrative,
"Computers and Digital Techniques, IEE Proceedings E",0143-7062,,1980,127,1,1993,140,6,4641395,,,,,,IEEE Xplore,host,http://ieeexplore.ieee.org/servlet/opac?punumber=4641395,IEEE Xplore,administrative,
"Computers, IEEE Transactions on",0018-9340,,1968,17,1,,,,12,,,,,,IEEE Xplore,host,http://ieeexplore.ieee.org/servlet/opac?punumber=12,IEEE Xplore,administrative,
Computing & Control Engineering Journal,0956-3385,,1990,1,1,2007,18,2,2218,,,,,,IEEE Xplore,host,http://ieeexplore.ieee.org/servlet/opac?punumber=2218,IEEE Xplore,administrative,
Computing in Science & Engineering,1521-9615,,1999,1,1,,,,5992,,,,,,IEEE Xplore,host,http://ieeexplore.ieee.org/servlet/opac?punumber=5992,IEEE Xplore,administrative,
"Concurrency, IEEE",1092-3063,,1997,5,1,2000,8,4,4434,,,,,,IEEE Xplore,host,http://ieeexplore.ieee.org/servlet/opac?punumber=4434,IEEE Xplore,administrative,
"Consumer Electronics Magazine, IEEE",2162-2248,,2012,1,1,2012,1,1,5962380,,,,,,IEEE Xplore,host,http://ieeexplore.ieee.org/servlet/opac?punumber=5962380,IEEE Xplore,administrative,
"Consumer Electronics, IEEE Transactions on",0098-3063,,1975,21,1,,,,30,,,,,,IEEE Xplore,host,http://ieeexplore.ieee.org/servlet/opac?punumber=30,IEEE Xplore,administrative,
Control & Automation,0956-3385,,2007,18,3,,,,4469873,,,,,,IEEE Xplore,host,http://ieeexplore.ieee.org/servlet/opac?punumber=4469873,IEEE Xplore,administrative,
"Control Systems Magazine, IEEE",0272-1708,,1981,1,1,1990,31,6,37,,,,,,IEEE Xplore,host,http://ieeexplore.ieee.org/servlet/opac?punumber=37,IEEE Xplore,administrative,
"Control Systems Technology, IEEE Transactions on",1063-6536,,1993,1,1,,,,87,,,,,,IEEE Xplore,host,http://ieeexplore.ieee.org/servlet/opac?punumber=87,IEEE Xplore,administrative,
"Control Systems, IEEE",1066-033X,,1991,11,1,,,,5488303,,,,,,IEEE Xplore,host,http://ieeexplore.ieee.org/servlet/opac?punumber=5488303,IEEE Xplore,administrative,
"Control Theory & Applications, IET",1751-8644,,2007,1,1,,,,4079545,,,,,,IEEE Xplore,host,http://ieeexplore.ieee.org/servlet/opac?punumber=4079545,IEEE Xplore,administrative,
"Control Theory and Applications, IEE Proceedings -",1350-2379,,1994,141,1,2006,153,6,2193,,,,,,IEEE Xplore,host,http://ieeexplore.ieee.org/servlet/opac?punumber=2193,IEEE Xplore,administrative,
"Control Theory and Applications, IEE Proceedings D",0143-7054,,1980,127,1,1993,140,6,2206,,,,,,IEEE Xplore,host,http://ieeexplore.ieee.org/servlet/opac?punumber=2206,IEEE Xplore,administrative,
"Dependable and Secure Computing, IEEE Transactions on",1545-5971,,2004,1,1,,,,8858,,,,,,IEEE Xplore,host,http://ieeexplore.ieee.org/servlet/opac?punumber=8858,IEEE Xplore,administrative,
"Design & Test of Computers, IEEE",0740-7475,,1984,1,1,,,,54,,,,,,IEEE Xplore,host,http://ieeexplore.ieee.org/servlet/opac?punumber=54,IEEE Xplore,administrative,
"Device and Materials Reliability, IEEE Transactions on",1530-4388,,2001,1,1,,,,7298,,,,,,IEEE Xplore,host,http://ieeexplore.ieee.org/servlet/opac?punumber=7298,IEEE Xplore,administrative,
"Dielectrics and Electrical Insulation, IEEE Transactions on",1070-9878,,1994,1,1,,,,94,,,,,,IEEE Xplore,host,http://ieeexplore.ieee.org/servlet/opac?punumber=94,IEEE Xplore,administrative,
"Display Technology, Journal of",1551-319X,,2005,1,1,,,,9425,,,,,,IEEE Xplore,host,http://ieeexplore.ieee.org/servlet/opac?punumber=9425,IEEE Xplore,administrative,
"Distributed Systems Online, IEEE",1541-4922,,2004,5,1,2008,9,12,8968,,,,,,IEEE Xplore,host,http://ieeexplore.ieee.org/servlet/opac?punumber=8968,IEEE Xplore,administrative,
"Education, IEEE Transactions on",0018-9359,,1963,6,1,,,,13,,,,,,IEEE Xplore,host,http://ieeexplore.ieee.org/servlet/opac?punumber=13,IEEE Xplore,administrative,
"Education, IRE Transactions on",0893-7141,,1958,1,1,1962,5,3,4321999,,,,,,IEEE Xplore,host,http://ieeexplore.ieee.org/servlet/opac?punumber=4321999,IEEE Xplore,administrative,
"Electric Power Applications, IEE Journal on",0140-1327,,1978,1,1,1979,2,6,4807343,,,,,,IEEE Xplore,host,http://ieeexplore.ieee.org/servlet/opac?punumber=4807343,IEEE Xplore,administrative,
"Electric Power Applications, IEE Proceedings -",1350-2352,,1994,141,1,2006,153,6,2194,,,,,,IEEE Xplore,host,http://ieeexplore.ieee.org/servlet/opac?punumber=2194,IEEE Xplore,administrative,
"Electric Power Applications, IEE Proceedings B",0143-7038,,1980,127,1,1993,140,6,2204,,,,,,IEEE Xplore,host,http://ieeexplore.ieee.org/servlet/opac?punumber=2204,IEEE Xplore,administrative,
"Electric Power Applications, IET",1751-8660,,2007,1,1,,,,4079749,,,,,,IEEE Xplore,host,http://ieeexplore.ieee.org/servlet/opac?punumber=4079749,IEEE Xplore,administrative,
"Electrical and Computer Engineering, Canadian Journal of",0840-8688,,2003,28,1,,,,9754,,,,,,IEEE Xplore,host,http://ieeexplore.ieee.org/servlet/opac?punumber=9754,IEEE Xplore,administrative,
"Electrical Engineers - Part I: General, Journal of the Institution of",,,1941,88,1,1948,95,96,5293616,,,,,,IEEE Xplore,host,http://ieeexplore.ieee.org/servlet/opac?punumber=5293616,IEEE Xplore,administrative,
"Electrical Engineers - Part II: Power Engineering, Journal of the Institution of",,,1941,88,1,1948,95,48,5294946,,,,,,IEEE Xplore,host,http://ieeexplore.ieee.org/servlet/opac?punumber=5294946,IEEE Xplore,administrative,
"Electrical Engineers - Part IIA: Automatic Regulators and Servo Mechanisms, Journal of the Institution of",,,1947,94,1,1947,94,2,5296781,,,,,,IEEE Xplore,host,http://ieeexplore.ieee.org/servlet/opac?punumber=5296781,IEEE Xplore,administrative,
